course_id,Course_Title,Course_URL,Platform,Language,Description,Skill,Level,Price_Model,monthly_price,Programming Instructor,Last Update,offering_type,Duration_Hours,Review_Count,Avg_Rating,enrolled_students,Best_Category
nd002,Data Analyst,https://www.udacity.com/course/data-analyst-nanodegree--nd002,Udacity,en-us,"Clean up messy data, uncover patterns and insights, and communicate your findings. You'll start with an introduction to data analysis tools, including Jupyter Notebook, NumPy, pandas, and Matplotlib. Using these tools, you will ask questions about data and answer them through data collection, exploration, wrangling, and visualization. This intermediate-level program includes real-world projects where you will choose your own datasets, research questions, and analysis approach. As you progress through the program, each course will repeat the data analysis process while introducing more advanced techniques, such as applying data imputation to fill in missing data and applying appropriate encodings when developing data visualizations.","Latent variables, Data fluency, Exploratory data analysis, Professional presentations, Data limitations and biases, Data storytelling, Jupyter notebooks, Quantitative data visualization, Data visualization design, Data cleaning, Data storage, Data Tidiness Assessment, Data gathering, Data wrangling, Pandas, Data quality assessment, File i/o, Basic data visualizations, Data analysis process, NumPy, Data manipulation",Intermediate,Subscription,12700,"Josh Magee, Ria Cheruvu, Matt Maybeno",2025-10-21 14:22:09.030000+00:00,Nanodegree,43 hours,1295,4.8,26584,Data Analytics
nd104,Programming for Data Science with Python,https://www.udacity.com/course/programming-for-data-science-nanodegree--nd104,Udacity,en-us,"Learn programming skills needed to uncover patterns and insights in large data sets, running queries with relational databases and working with Unix shell and Git.","NumPy, Pandas, SQL aggregations, SQL joins, SQL queries, Control flow, Built-in Python functions, Python methods, Python function definition, SQL subqueries, SQL window functions, Unix shell, Python package management, Python data types, Iterators, Python exception handling, Python best practices, Python operators, Python data structures, Docstrings, Anaconda, Python ides, Variable scope, List comprehension, Python syntax, User input handling, Data storytelling, Tableau data pane, Tableau map-based visualizations, Tableau interactive dashboards, Tableau field organization and customization, Data visualization design, Tableau visualizations, Chart selection, Tableau storypoint, Tableau calculated fields, Git, Data cleaning, SQL query performance tuning, Python scripting",Beginner,Subscription,12700,"Josh Bernhard, Karl Krueger, Derek Steer, Richard Kalehoff, Juno Lee",2026-04-05 11:21:16.687000+00:00,Nanodegree,53 hours,837,4.8,35223,Data Analytics
nd000,Introduction to Programming,https://www.udacity.com/course/intro-to-programming-nanodegree--nd000,Udacity,en-us,"Welcome to the world of programming! Learn the skills that all programmers use, whether they build apps, web pages, or analyze data.","Control flow in Python, Command line interface basics, Python functions, Object-oriented Python, CSS, Python data structures, Text processing in Python, Code debugging, Python operators, Python classes, API requests, Variable scope, Python syntax, User input handling, Front-end development basics, Python methods, Python exception handling, Python lists, Computer memory architecture, Python standard library, Coding best practices, Python data types, Linting, Pep8, Code refactoring, Bash, Shell scripting, Built-in Python functions, Python turtle, Python function definition, Commenting code, Python variables, Devtools, Flexbox, JavaScript functions, JavaScript console, Control flow in JavaScript, JavaScript data structures, JavaScript data types, JSON, Basic Python, Python scripting, HTML",Beginner,Subscription,12700,"Kelly Howard, Karl Krueger, Rachel Manning, Abe Feinberg, Richard Kalehoff, Julia Van Cleve, James Parkes",2026-04-22 16:40:41.105000+00:00,Nanodegree,109 hours,1342,4.8,52251,Programming
nd089,AI Programming with Python,https://www.udacity.com/course/ai-programming-python-nanodegree--nd089,Udacity,en-us,"Develop a strong foundation in Python programming for AI, utilizing tools like NumPy, pandas, and Matplotlib for data analysis and visualization. Learn how to use, build, and train machine learning models with popular Python libraries. Implement neural networks using PyTorch. Gain practical experience with deep learning frameworks by applying your skills through hands-on projects. Explore generative AI with Transformer neural networks, learn to build, train, and deploy them with PyTorch, and leverage pre-trained models for natural language processing tasks. Designed for individuals with basic programming experience, this program prepares you for advanced studies in AI and machine learning, equipping you with the skills to begin a career in AI programming.","Generative AI Awareness, Text generation, Attention mechanisms, GPT, Hugging Face, Transformer neural networks, Foundation Model Concepts, Word embeddings, PyTorch, Natural language processing, NLP transformers, Logistic regression, Deep learning framework proficiency, Classification models, Feedforward neural networks, Deep learning, Transfer learning, Training neural networks, Neural network basics, Basic PyTorch, Gradient descent, Perceptron, Neural network mechanics, Backpropagation, Python package management, Pandas, Pip, Anaconda, matplotlib, Jupyter notebooks, NumPy, Python packaging, Python functions, Basic Python, Python methods, Text processing in Python, Functional Python, Boolean expressions, Python operators, List comprehension, Python syntax, Python data types, Python best practices, Python variables, Control flow in Python, Python Certified Entry-Level Programmer, Python string methods, Python exception handling, Built-in Python functions, Python function definition, Python data structures, Python collections",Beginner,Subscription,12700,"Brian Hough, Mat Leonard, Juan Delgado, Juno Lee, Mike Yi, PhD, Luis Serrano, Ivan Mushketyk",2026-04-08 09:56:13.822000+00:00,Nanodegree,52 hours,645,4.7,20084,Programming
cd13224,Generative AI Fluency,https://www.udacity.com/course/generative-ai-fluency--cd13224,Udacity,en-us,"This course provides a comprehensive high-level overview of Generative AI, beginning with foundational concepts and terminology and then delving into specific applications such as Large Language Models (LLMs) for text generation and diffusion-based models image creation. Key lessons include an in-depth look at LLMs, AI image generation methods, and hands-on experience with tools like DALL-E and Midjourney. The course concludes by addressing practical aspects of deploying Generative AI in production environments, focusing on data collection, prompt execution, maintenance, and orchestration strategies.",Generative AI Fluency,Fluency,Subscription,12700,"Uohna Thiessen, Rohan Viswanathan, Giacomo Vianello, Raphael Mallari, Ed Wiley, Erick Galinkin, Chang She, Sergei Kozyrenko, Emily McMilin",2026-03-15 14:23:21.413000+00:00,single course,7 hours,289,4.8,10269,Artificial Intelligence
cd14380,Agentic AI Fluency,https://www.udacity.com/course/agentic-ai-fluency--cd14380,Udacity,en-us,"Go beyond basic chatbots and understand the next wave of automation.  Learn what AI Agents are and how they work. You will explore the core concepts of agentic reasoning, planning, and tool use. Gain the knowledge to identify high-value opportunities for agentic systems in your business, evaluate their performance, and collaborate effectively with technical teams on AI initiatives.","Agentic AI, AI Agents, Agentic Reasoning Frameworks",Fluency,Subscription,12700,"Noble Ackerson, Gordon Dri",2026-05-06 10:41:42.868000+00:00,single course,6 hours,152,4.7,3642,Artificial Intelligence
nd027,Data Engineering with AWS,https://www.udacity.com/course/data-engineer-nanodegree--nd027,Udacity,en-us,"Learn to design data models, build data warehouses and data lakes, automate data pipelines, and work with massive datasets.","PostgreSQL, Database normalization, Denormalized data schemas, Data modeling basics, Data pipeline dags, Data pipeline partitioning, Amazon s3, Data pipeline maintenance, Redshift, Data pipeline creation, Apache Airflow, Data lineage, AWS data lakes, ELT, Big data fluency, Data wrangling, Amazon Athena, Data Lakehouse Architecture, Data transformation, Apache Spark, Data format fundamentals, AWS glue, Data lakes, Data extraction, Column-oriented dbmss, Snowflake schemas, Table design, ETL, Data validation, Data warehouse architecture, Star schemas, AWS data warehouse, Online transactional processing models, AWS database services, Data definition language, Neo4j, Database fundamentals, NoSQL data models, Mongodb, Relational data models, Online analytical processing models, Document database schemas",Intermediate,Subscription,12700,"Sean Murdock, Matt Swaffer, Ben Goldberg, Amanda Moran, Valerie Scarlata",2026-04-12 11:57:38.944000+00:00,Nanodegree,39 hours,1277,4.6,37495,Database
nd018,Digital Marketing,https://www.udacity.com/course/digital-marketing-nanodegree--nd018,Udacity,en-us,"Build job-ready digital marketing skills by learning from industry experts. Run live campaigns, analyze results, and apply proven techniques to engage audiences and strengthen brand performance in this comprehensive Nanodegree.","Social media advertising, Content calendars, Social media marketing platforms, Social media content, Digital marketing campaign evaluation, Target personas, Social media campaign objectives, Facebook ads, Social media marketing metrics, Social media community management, Leveraging social media influencers, Marketing objectives, Marketing channels, Customer journey maps, Value proposition, Marketing metrics, Empathy maps, Email contact forms, Email marketing metrics, Mailchimp, Email marketing content, A/B testing, Audience targeting, Google ads, Native advertising, Ad campaign management, Programmatic display advertising, Display advertising, Video advertising, Search text ads, Cost per click, Search engine ad ranking, Keyword lists, Dynamic search ads, Digital marketing metrics, Search engine optimization, SEO audits, Link building, Social media marketing, Utm codes, Audience evaluation, MarTech fluency, Marketing KPIs, Google analytics fundamentals, Conversion tracking, Agile marketing, Competitive analysis, Branding strategy, Content marketing strategy, Marketing fundamentals",Beginner,Subscription,12700,"Liana Gross Furini, Jen Crompton, John Triggs, Matt Bailey, Erica Reid, Benjamin Kepner, Dawn Raquel Jensen, Daniel Kob, Anke Audenaert",2025-08-18 14:28:45.973000+00:00,Nanodegree,73 hours,1031,4.7,30752,Other
nd098,Business Analytics with Tableau,https://www.udacity.com/course/business-analytics-nanodegree--nd098,Udacity,en-us,"Dive into business analytics with this Nanodegree. Master Excel, SQL, and Tableau to analyze data, create interactive dashboards, and deliver insights that drive informed, impactful business decisions.","Univariate and Bivariate Chart Selection, Tableau Aggregations, Tableau visualizations, Tableau proficiency, Tableau Marks and Filters, Data Visualization Design Integrity, Interactive and Responsive Tableau Dashboard Design, Tableau hierarchies, Tableau Dashboard Creation, Connecting to Data and Setting Up Tableau, Tableau interactive dashboards, Tableau Chart Types, Tableau storypoint, Color and Visual Encodings, Tableau groups, Building and Saving Worksheets in Tableau, Tableau calculated fields, SQL joins, SQL Clauses, SQL subqueries, SQL Operators, SQL Data Cleaning, SQL aggregations, Basic SQL, Scatter Plot Awareness, Growth metrics, Spreadsheet Navigation, Data visualization in spreadsheets, KPI Awareness, Lookups and Pivoting, Finance metrics, Line and Area Charts in Spreadsheets, Basic spreadsheet use, Tabular Data Awareness, Spreadsheet Operations, Efficiency Metrics, Data Relationships, Pie Charts in Spreadsheets, Spreadsheet Cell Referencing, Scatter Plots in Spreadsheets, Pie Chart Awareness, Business metrics, Customer Satisfaction Metrics, Bar and Column Charts in Spreadsheets, Function and Formula Syntax, Histograms in Spreadsheets, Bar and Column Chart Awareness, Spreadsheet functions, Data types, Histogram Awareness, Profitability Metrics, Date and Data Cleanup, Basic descriptive statistics, Line and Area Chart Awareness, Chart types, Chart Selection and Formatting in Spreadsheets, Innovation Metrics, Pivot tables, Data Summarization, Logic and Aggregation Formulas",Beginner,Subscription,12700,"Jayden Ziegler, David Elliott, Derek Steer, Josh Bernhard, Jennie Lytel-Sternberg",2026-03-09 15:40:45.227000+00:00,Nanodegree,40 hours,1254,4.8,38455,Data Analytics
nd036,Product Manager,https://www.udacity.com/course/product-manager-nanodegree--nd036,Udacity,en-us,Build job-ready skills for a successful PM career with this comprehensive Nanodegree program. Learn the fundamentals of product management from strategy planning to launch with expert guidance and hands-on projects.,"Product design sprints, Product scaling, Project evaluation, Solution sketching, Problem validation, Product management basics, Product proposals, Stakeholder management, Product roadmaps, End-user documentation, Feedback loops, A/B testing, Project risk mitigation, Competitive analysis, Stakeholder identification, Decision matrix method, Product validation, User research planning, Evangelization, Press releases, Thinking hats, Crazy 8s, Product success metrics, Product design principles, User interviews, Iterative product design, Technical feasibility evaluation, Affinity mapping, Product storyboarding, Product KPIs, High fidelity prototypes, How might we method, Business model canvasses, Requirements gathering, Return on investment, Active listening, Professional presentations, Product development cycle, Storytelling, Product requirements documents, Total addressable market, Minimal viable products, Mixed methods market research, Product marketing, Product pricing strategy, Negotiation, Product launch, Project management frameworks, Prioritization, Cross-functional collaboration, Functional testing, Real-world Testing, Persuasion, Product prototyping, User personas",Beginner,Subscription,12700,"Alex King, Anastasia Root",2026-01-12 13:27:00.930000+00:00,Nanodegree,50 hours,655,4.7,30340,Business & Management
nd101,Deep Learning,https://www.udacity.com/course/deep-learning--nd101,Udacity,en-us,"Build foundational skills in deep learning by designing and training neural networks to solve complex real-world problems. You’ll begin with the essentials of neural networks, advancing to specialized architectures like Convolutional and Recurrent Neural Networks, along with  Transformers, Generative Adversarial Networks and Diffusion Models. Through projects, create models for applications such as image classification, Q&A, and CAPTCHA image generation, gaining hands-on experience with PyTorch and advanced training techniques. Ideal for those aiming to harness the potential of deep learning, this experience prepares you to tackle AI challenges across various domains.","GAN Training Optimization, Generative adversarial networks, U-net, Generative AI Fluency, Implementing GAN Training Optimization, Implementing Diffusion Model Sampling, Implementing Generator Networks, Deep Convolutional GAN Architecture, Latent Space Concepts, Implementing Diffusion Models, Implementing Discriminator Networks, Conditional Image Generation, Adversarial Training Concepts, GenAI Architectures, Implementing Deep Convolutional GANs, Diffusion Models, Implementing GAN Training, Implementing Conditional GANs, Recurrent neural networks, Implementing Word Embeddings, Transformer neural networks, Word embeddings, Implementing Attention Mechanisms, Generative AI Evaluation, Implementing Recurrent Neural Networks, Hugging Face, Implementing Sequence-to-Sequence Models, Generative AI Evaluation Implementation, Sequential text analysis, Sequence-to-Sequence Models, NLP models, Implementing Tokenization, Attention mechanisms, Tokenization, Implementing Transformer Fine-Tuning, Implementing Data Augmentation Pipelines, Implementing Neural Style Transfer, Computer vision fluency, Data augmentation, Semantic image segmentation, Implementing Object Detection, Convolutional kernels, Convolutional Layer Configuration, Deep learning techniques, Convolutional neural networks, Implementing Convolutional Layers, Implementing Convolutional Autoencoders, Autoencoders, Implementing CNN Pooling Layers, CNN Architecture Evolution, CNN Pooling Concepts, Transfer learning, Implementing Advanced CNN Training, Implementing Image Segmentation, Feature visualization, Implementing Convolutional Neural Networks, Object detection, Implementing CNN Transfer Learning, Neural network basics, Backpropagation, Implementing Feedforward Neural Networks, Deep learning model optimization, Model evaluation, Deep learning fluency, Implementing Neural Network Forward Propagation, Deep learning models, Data pre-processing for ML, Hyperparameter tuning, Neural network activation, Neural network mechanics, Model performance metrics, Deep Learning Model Diagnostics, Perceptron, Neural Network Loss Function Concepts, Implementing Neural Network Activation Functions, Implementing Deep Learning Data Pipelines, Feedforward neural networks, Training neural networks, Implementing Deep Learning Model Diagnostics, Implementing Neural Network Loss Functions, Deep learning",Intermediate,Subscription,12700,"Samantha Guerriero, Antje Muntzinger, Sohbet Dovranov, Temi Afeye",2026-03-25 15:48:04.852000+00:00,Nanodegree,50 hours,985,4.7,46493,Artificial Intelligence
nd003,iOS Development with SwiftUI and SwiftData,https://www.udacity.com/course/ios-developer-nanodegree--nd003,Udacity,en-us,"Become skilled in developing high-quality iOS apps. This comprehensive Nanodegree program teaches Swift proficiency, UI design, data management, data integration, and project planning so you can take apps from idea to reality.","iOS Development, HTTP, Credential management, Application authentication, Network requests in swift, Authentication, Swift data persistence, Swift classes, Data binding, Application state management, Data modeling basics, Mobile data management, iOS Core Data, iOS View Hierarchy, iOS Tab Navigation, iOS Animations, Xcode ide basics, iOS Stack Navigation, iOS UI Development, Uiviews, iOS Affordances, Ui design, iOS SplitView Navigation, iOS Gestures, Swift closures, Swift sets, Swift Generics, Swift enums, Swift functions, Control flow, Swift properties, Basic swift, Swift class extensions, Swift data types, Swift inheritance, Swift structs, String manipulation in swift, Swift operators, Swift arrays, Swift methods, Swift Tuples, Swift protocols, Boolean expressions, Swift Error Handling, Swift constants, Swift dictionaries, Swift optionals, Swift collections, Swift syntax, Swift grand central dispatch, Swift file management, Swift NSUserDefaults, Avfoundation framework, Code debugging, Swift and objective-c interoperability, JSON, Swift ibactions, Model-view-controller, Swift queues, Firebase, Uiimagepickercontroller, Https, Swift iboutlets, Swift autolayout, Secure network requests, Code refactoring, Git, Uikit classes, Apple app transport security protocol, Uitableview",Intermediate,Subscription,12700,Valerie Scarlata,2025-12-14 15:37:07.428000+00:00,Nanodegree,76 hours,253,4.6,8974,Mobile Development
nd025,Data Scientist,https://www.udacity.com/course/data-scientist-nanodegree--nd025,Udacity,en-us,"This advanced Nanodegree prepares you to tackle data science at scale. Work with AI best practices, build production-ready projects, and gain the confidence to lead data-driven solutions.","Blog posts, Magic methods, Unit testing, Data storytelling, CRISP-DM, AI algorithms in Python, Github portfolios, Similarity Score, Principal component analysis, Dimensionality reduction, Types of recommenders, Cluster validation, K-means clustering, Recommender system limitations, Basic unsupervised learning, Feature visualization, Recommendation engines, Matrix factorization, Hierarchical clustering models, Latent variables, Actionable insight generation, Evaluating unsupervised learning models, Business metrics, PyTorch, Tokenization, Convolutional neural networks, NLP pipelines, Stemming, Machine learning pipeline creation, NLP models, Part of speech tagging, Model cross-validation, Support vector machines, Data pre-processing for ML, Lemmatization, Feature extraction, Image pre-processing, Opencv, Computer vision fluency, Hyperparameter tuning, Python virtual environments, Model deployment, Inheritance, Github actions, Object-oriented design patterns, Python package management, Web forms, Object-oriented Python, Python packaging, Python decorator functions, Linting, Python classes, Feature importance calculation, Model bias analysis, Gradient descent, Random forest models, Tree-based models, scikit-learn, Model evaluation, Neural network basics, Basic supervised machine learning",Advanced,Subscription,12700,"David Elliott, Antje Muntzinger, Nathan Klarer, Joshua Bernhard, Jo-L Collins, Victor Geislinger, Matt Maybeno",2026-03-10 13:22:41.915000+00:00,Nanodegree,61 hours,813,4.8,34257,Machine Learning
nd900,Agentic AI,https://www.udacity.com/course/agentic-ai--nd900,Udacity,en-us,"Go beyond single chatbots to engineer sophisticated, coordinated teams of AI agents. This Nanodegree guides you from advanced prompting techniques like Chain-of-Thought and ReAct to designing agentic workflows with patterns like Routing and Parallelization. You'll master building and orchestrating agents in Python that can reason, plan, and use tools to interact with databases and external APIs. Build a powerful portfolio by tackling hands-on projects, including a multi-agent travel planner, an AI-powered project manager, and a fully automated sales system, to solve real-world problems.","Multi-Agent System Design, Multi-Agent State Management Concepts, Multi-Agent Systems, Multi-Agent State Coordination Concepts, Implementing Multi-Agent Architectures, Implementing Multi-Agent State Management, Multi-Agent Implementation, Implementing Multi-Agent Orchestration, Implementing Multi-Agent State Coordination, Multi-Agent Agent Orchestration Concepts, Implementing Multi-Agent Routing, Implementing Multi-Agent RAG, Multi-Agent Routing Concepts, Multi-Agent RAG Concepts, Implementing API Integration for Agents, Implementing Single-agent RAG, Implementing AI Agent Evaluation, State Management for AI Agents, API Integration for Agents, Implementing Long-term Memory Management for AI Agents, Agent Tool Use, Database Interaction for AI Agents, Long-term Memory Management for AI Agents, Implementing Agent Memory, Implementing State Management for AI Agents, Agent Memory Design, Implementing Agent Tool Use, Web Search Integration & Data Retrieval for AI Agents, Evaluating AI Agents, Implementing Database Interaction for AI Agents, Implementing LLM Structured Outputs, Single-Agent Retrieval Augmented Generation, Implementing Web Search Integration and Data Retrieval for AI Agents, LLM Structured Outputs, Agentic Task Routing Design, Implementing Agentic Workflows, Implementing Agent Orchestration, Agentic Iterative Refinement Workflow Design, Agentic Workflow Design & Visualization, Implementing Parallel Agent Workflows, Implementing Sequential Task Prompt Chain Workflows, Agentic Task Routing, Agent Orchestration Design, Sequential Task Decomposition for Prompt Chaining, Implementing Reflective AI Workflows, Agentic Parallel Workflow Design, Iterative Prompt Development, Implementing Role-Based Prompting, Feedback Loop Design, Persona-Based Prompt Design, Implementing Prompt Chains, Systematic Prompt Refinement, CoT and ReAct, Agentic Reasoning Frameworks, Prompt Chain Design, Implementing Feedback Loops",Intermediate,Subscription,12700,"Brian Cruz, Peter Kowalchuk, Henrique Santana, Joshua Bernhard, Christopher Agostino",2026-05-04 11:05:58.834000+00:00,Nanodegree,53 hours,413,4.8,14286,Artificial Intelligence
