course_id,Course_Title,Course_URL,Platform,Language,Description,Skill,Level,Price_Model,monthly_price,Programming Instructor,Last Update,offering_type,Duration_Hours,Review_Count,Avg_Rating,enrolled_students,Best_Category
cd12531,Advanced Data Wrangling,https://www.udacity.com/course/advanced-data-wrangling--cd12531,Udacity,en-us,"Data wrangling is a set of processes for turning raw and messy data into a clean format to answer interesting questions from the data. In this course, you will learn the three phases of data wrangling: gathering, assessing, and cleaning data.","Data cleaning, Data storage, Data Tidiness Assessment, Data gathering, Data wrangling, Pandas, Data quality assessment, File i/o",Intermediate,Subscription,12700,Ria Cheruvu,2025-10-21 14:22:02.946000+00:00,single course,15 hours,0,0,0,Data Analytics
nd790,Embedded Systems Fundamentals,https://www.udacity.com/course/embedded-systems-fundamentals--nd790,Udacity,en-us,"Refine your technical foundation with this Nanodegree in embedded systems. Explore microcontrollers, logic circuits, and digital signal processing while building hands-on skills through breadboarding, device control, and prototyping projects.","Logic Circuits, Digital signal processing proficiency, Logic Gates",Beginner,Subscription,12700,Ozgur Cagdas,2025-10-07 14:10:51.865000+00:00,Nanodegree,33 hours,0,0,0,Embedded Systems
cd0692,Social Media Marketing,https://www.udacity.com/course/social-media-marketing--cd0692,Udacity,en-us,"Explore the world of social media marketing. From content calendars to targeted ads, learn how to plan, execute, and optimize campaigns that align with customer journeys and brand objectives.","Social media advertising, Content calendars, Social media marketing platforms, Social media content, Digital marketing campaign evaluation, Target personas, Social media campaign objectives, Facebook ads, Social media marketing metrics, Social media community management, Leveraging social media influencers, Social media marketing",Beginner,Subscription,12700,Erica Reid,2025-08-18 14:25:07.534000+00:00,single course,12 hours,5,4.8,170,Other
cd0281,Introduction to Neural Networks with PyTorch,https://www.udacity.com/course/introduction-to-neural-networks-with-pytorch--cd0281,Udacity,en-us,"Learn the fundamentals of neural networks with Python and PyTorch, and then use your new skills to create your own image classifier—an application that will first train a deep learning model on a dataset of images and then use the trained model to classify new images.","Gradient descent, AI algorithms in Python, Training neural networks, NumPy, Backpropagation, Overfitting prevention, Deep learning fluency, PyTorch",Beginner,Subscription,12700,"Luis Serrano, PhD, Mat Leonard, Erick Galinkin",2026-04-14 15:06:41.410000+00:00,single course,17 hours,0,0,0,Artificial Intelligence
cd0004,"Governance, Risk, and Compliance",https://www.udacity.com/course/governance-risk-and-compliance--cd0004,Udacity,en-us,"This course provides an overview of governance, risk, and compliance. It focuses on the importance of GRC, identifying GRC concerns, and ways to mitigate those concerns.","Security auditing, Cybersecurity grc, Cybersecurity business context, Cybersecurity compliance, Cybersecurity controls, Cybersecurity policy writing, Stakeholder management, Value-based security risk assessment, Security risk classification, Cybersecurity standards fluency, Security risk remediation, Cybersecurity training strategies, Cybersecurity risk management",Beginner,Subscription,12700,"Sean Pike, Esq., M.S.",2025-07-01 11:33:18.380000+00:00,single course,20 hours,7,5,140,Cyber Security
cd0041,Data Architecture Foundations,https://www.udacity.com/course/data-architecture-foundations--cd0041,Udacity,en-us,"In this course, you will cover the foundations of data architecture.","Erds, Data definition language, Data manipulation language, Data storage, SQL CRUD commands, Crow's foot notation, Data ingestion, Database normalization, Data governance fluency, Physical erds, Data architecture fluency, Logical erds, Database schemas, 3rd normal form, Database performance, Database flexibility, Conceptual erds, PostgreSQL, Database scalability, ETL, Crud model, Lucidchart",Advanced,Subscription,12700,Ben Larson,2026-03-10 13:02:30.546000+00:00,single course,20 hours,1,5,29,Database
cd0381,Advanced Java Programming Techniques,https://www.udacity.com/course/advanced-java-programming-techniques--cd0381,Udacity,en-us,"Sharpen your understanding of scalable systems with advanced Java topics like serialization, dependency injection, and multithreading. Ideal for developers pursuing roles in architecture, backend engineering, or technical leadership.","Java reflection, Design pattern fundamentals, Java stream API, Dependency injection, Computer memory familiarity, Java files API, Data encoding, Aspect-oriented programming, Resource leaks, Java best practices, Concurrent computing, Programming paradigms, JRE, Data serialization, Behavioral design patterns, Creational design patterns, Data deserialization, Structural design patterns, Parallel computing, Threading, Functional programming",Intermediate,Subscription,12700,Dustin Hellstern,2025-09-15 16:26:20.747000+00:00,single course,19 hours,4,5,95,Programming
cd13926,Building Generative AI Applications with Amazon Bedrock,https://www.udacity.com/course/building-generative-ai-applications-with-amazon-bedrock--cd13926,Udacity,en-us,"Build cutting-edge generative AI applications with Amazon Bedrock and Python. Learn to integrate models in applications using BOTO3 and APIs, leverage AWS services such as S3 and Amazon Aurora, and create end-to-end AI solutions. Through practical exercises and a real-world project, you'll gain expertise in Retrieval-Augmented Generation (RAG), embeddings, and secure AI pipelines.","Retrieval-Augmented Generation, Amazon Web Services, GenAI Models, Large Language Models",Beginner,Subscription,12700,Eduardo Mota,2025-10-01 18:43:13.058000+00:00,single course,11 hours,4,5,95,Artificial Intelligence
cd14550,Data Visualization in Power BI,https://www.udacity.com/course/data-visualization-in-power-bi--cd14550,Udacity,en-us,"Build compelling, interactive Power BI dashboards that transform raw data into actionable insights. Explore core Power BI features, including data ingestion, transformation, and visualization. Use Power Query and DAX to prepare data and perform calculations. Master core chart types and match visuals to business questions. Design clean, effective dashboards with layout, accessibility, and storytelling in mind. Learn how to apply interactive filters, slicers, and drill-downs. In the final project, showcase your skills by analyzing sales trends, customer segments, and top products for a retail business using best practices in design, data modeling, and DAX.",Not Specified,Intermediate,Subscription,12700,Joseph Lozada,2026-04-20 08:58:54.270000+00:00,single course,11 hours,4,4.8,162,Data Analytics
nd904,Microsoft Agentic AI,https://www.udacity.com/course/microsoft-agentic-ai--nd904,Udacity,en-us,"This Nanodegree program equips you with the skills to design, build, and deploy autonomous AI agents. Unlike standard LLM courses that focus on text generation, this program focuses on Agentic AI—enabling AI to perceive, reason, plan, and act. Leveraging the Microsoft Azure AI ecosystem, you will learn to implement robust prompting strategies, design agentic workflows, integrate external tools using Microsoft Semantic Kernel, and orchestrate multi-agent systems that collaborate to achieve complex goals within Microsoft Foundry.","Multi-Agent Implementation, Multi-Agent State Coordination Concepts, Implementing Multi-Agent State Management, Multi-Agent State Management Concepts, Implementing Multi-Agent State Coordination, Multi-Agent RAG Concepts, Multi-Agent Agent Orchestration Concepts, Multi-Agent Systems, Implementing Multi-Agent RAG, Multi-Agent System Design, Implementing Multi-Agent Orchestration, Multi-Agent Routing Concepts, Implementing Multi-Agent Routing, Implementing Agent Tool Use, Agent Tool Use, Implementing API Integration for Agents, LLM Structured Outputs, Web Search Integration & Data Retrieval for AI Agents, API Integration for Agents, Single-Agent Retrieval Augmented Generation, Agent Memory Design, Implementing Web Search Integration and Data Retrieval for AI Agents, Implementing Long-term Memory Management for AI Agents, Implementing Database Interaction for AI Agents, Implementing Agent Memory, Implementing LLM Structured Outputs, State Management for AI Agents, Implementing State Management for AI Agents, Database Interaction for AI Agents, Evaluating AI Agents, Implementing Single-agent RAG, Long-term Memory Management for AI Agents, Implementing AI Agent Evaluation, Implementing Agent Orchestration, Sequential Task Decomposition for Prompt Chaining, Agentic Iterative Refinement Workflow Design, Implementing Sequential Task Prompt Chain Workflows, Agentic Task Routing Design, Agentic Task Routing, Implementing Reflective AI Workflows, Implementing Agentic Workflows, Agentic Workflow Design & Visualization, Agentic Parallel Workflow Design, Implementing Parallel Agent Workflows, Agent Orchestration Design, Implementing Feedback Loops, Azure AI Services, Agentic Reasoning Frameworks, AI Agents, Feedback Loop Design, Persona-Based Prompt Design, Prompt Engineering, Azure AI Studio, Implementing Role-Based Prompting, Prompt Chain Design, Azure AI Studio Model Management",Intermediate,Subscription,12700,"Brian Cruz, James Willett, Peter Kowalchuk, Henrique Santana, James Wall, Tawadros Nemer, Christopher Agostino",2026-03-29 18:02:45.978000+00:00,Nanodegree,56 hours,1,5,29,Artificial Intelligence
cd0385,Introduction to Machine Learning,https://www.udacity.com/course/introduction-to-machine-learning--cd0385,Udacity,en-us,"Gain foundational machine learning expertise using AWS SageMaker, from data preparation and exploratory analysis to deploying powerful models like XGBoost and AutoGluon. Covering the entire ML workflow, including feature engineering, model tuning, and evaluation, you'll gain practical experience with real-world data projects. Designed for those familiar with Python and data science basics, the curriculum equips you to handle diverse ML tasks confidently and effectively, making it ideal for anyone looking to apply machine learning in various professional and industry settings.","Feature engineering, Machine learning fluency, AI business context, Machine learning use cases, Data loading with sagemaker, Amazon s3, Model training, Linear models, Xgboost, Autogluon, Pandas, Sagemaker studio notebooks, Model performance metrics, Tree-based models, Sagemaker ground truth, Machine learning lifecycle, Dataset annotation, Sagemaker jumpstart, Machine learning dataset fundamentals, scikit-learn, Automated machine learning, Sagemaker data wrangler, Hyperparameter tuning",Intermediate,Subscription,12700,Matt Maybeno,2025-04-07 08:39:22.835000+00:00,single course,18 hours,1,4,25,Machine Learning
cd1818,Constructing and Training Neural Networks,https://www.udacity.com/course/constructing-and-training-neural-networks--cd1818,Udacity,en-us,"This course covers foundational deep learning theory and practice. We begin with how to think about deep learning and when it is the right tool to use. The course covers the fundamental algorithms of deep learning, deep learning architecture and goals, and interweaves the theory with implementation in PyTorch.","Neural network basics, Backpropagation, Implementing Feedforward Neural Networks, Deep learning model optimization, Model evaluation, Deep learning fluency, Implementing Neural Network Forward Propagation, Deep learning models, Data pre-processing for ML, Hyperparameter tuning, Neural network activation, Neural network mechanics, Model performance metrics, Deep Learning Model Diagnostics, Perceptron, Neural Network Loss Function Concepts, Implementing Neural Network Activation Functions, Implementing Deep Learning Data Pipelines, Feedforward neural networks, Training neural networks, Implementing Deep Learning Model Diagnostics, Implementing Neural Network Loss Functions",Intermediate,Subscription,12700,Samantha Guerriero,2026-03-25 15:45:17.928000+00:00,single course,15 hours,1,4,43,Artificial Intelligence
nd906,Google Agentic AI Engineer,https://www.udacity.com/course/google-agentic-ai-engineer--nd906,Udacity,en-us,"This Nanodegree program teaches advanced prompting techniques for effective LLM reasoning using Google Gemini, including chain-of-thought and feedback loops. You will then learn how to design and implement complex agentic workflows using the Agent Development Kit (ADK) and common patterns like routing and parallelization. You will also learn how to empower agents by integrating external tools, APIs, databases, web search, and RAG, while implementing memory management and observability. The program concludes with designing, building, and orchestrating multi-agent systems where specialized agents collaborate to solve complex problems using ADK, the Agent2Agent (A2A) protocol, and multi-agent RAG with Vertex AI Search.","Implementing Multi-Agent State Management, Applying Multi-Agent Architecture Design, Multi-Agent Systems, Multi-Agent State Management Concepts, MCP, Multi-Agent System Design, Multi-Agent Agent Orchestration Concepts, Multi-Agent State Coordination Concepts, Multi-Agent Implementation, Implementing Multi-Agent Architectures, Multi-Agent RAG Concepts, Google ADK, Implementing Multi-Agent Orchestration, Vertex AI, Implementing Multi-Agent State Coordination, Implementing Multi-Agent Routing, Implementing Multi-Agent RAG, Multi-Agent Routing Concepts, Evaluating AI Agents, Implementing LLM Structured Outputs, Web Search Integration & Data Retrieval for AI Agents, LLM Structured Outputs, Implementing Long-term Memory Management for AI Agents, Implementing State Management for AI Agents, Implementing Database Interaction for AI Agents, State Management for AI Agents, Implementing AI Agent Evaluation, Database Interaction for AI Agents, Agent Tool Use, Implementing Single-agent RAG, Agent Memory Design, Implementing Web Search Integration and Data Retrieval for AI Agents, Single-Agent Retrieval Augmented Generation, AI Agent Observability, Implementing API Integration for Agents, Long-term Memory Management for AI Agents, Implementing Agent Memory, Implementing Agent Tool Use, API Integration for Agents, Agentic Parallel Workflow Design, Sequential Task Decomposition for Prompt Chaining, Implementing Agent Orchestration, Implementing Sequential Task Prompt Chain Workflows, Agent Orchestration Design, Agentic Task Routing Design, Agentic Task Routing, Implementing Agentic Workflows, Implementing Parallel Agent Workflows, Systematic Prompt Refinement, Persona-Based Prompt Design, Implementing Feedback Loops, Feedback Loop Design, CoT and ReAct, Gemini API, Implementing Prompt Chains, Implementing Role-Based Prompting, Agentic Reasoning Frameworks, Prompt Chain Design",Intermediate,Subscription,12700,"Brian Cruz, Noble Ackerson, Peter Kowalchuk, Henrique Santana, Allen Firstenberg, Joshua Bernhard, Christopher Agostino",2026-04-25 18:02:27.995000+00:00,Nanodegree,55 hours,3,5,132,Cloud Computing
cd13905,Programming Transformer Neural Networks with PyTorch,https://www.udacity.com/course/programming-transformer-neural-networks-with-PyTorch--cd13905,Udacity,en-us,"This course will guide you through the essential concepts of Transformer Neural Networks and their implementation using PyTorch. Starting with an introduction to Transformers, you will learn to build and train Transformer models from scratch. Additionally, you will explore the advantages of using pre-trained Transformer models and how to leverage them effectively in your projects. By the end of this course, you will have a solid foundation in programming Transformer Neural Networks with PyTorch.",Transformer neural networks,Beginner,Subscription,12700,Ivan Mushketyk,2025-06-03 04:10:50.533000+00:00,single course,4 hours,0,0,0,Artificial Intelligence
cd0017,Introduction to Data Science and Supervised Machine Learning,https://www.udacity.com/course/introduction-to-data-science--cd0017,Udacity,en-us,"Learn core data science concepts and apply supervised machine learning models in real projects. Build your portfolio, master evaluation techniques, and gain practical skills to stand out in data-driven careers.","Blog posts, Data storytelling, CRISP-DM, AI algorithms in Python, Github portfolios, Feature importance calculation, Model bias analysis, Gradient descent, Random forest models, Tree-based models, scikit-learn, Model evaluation, Neural network basics, Basic supervised machine learning",Advanced,Subscription,12700,"David Elliott, Antje Muntzinger, Nathan Klarer, Joshua Bernhard",2025-11-02 23:03:43.792000+00:00,single course,12 hours,0,0,0,Data Science
cd12721,"Understanding Connectivity, 5G and NextG",https://www.udacity.com/course/understanding-connectivity-5G-and-nextG--cd12721,Udacity,en-us,"Topics explore a wide set of areas of 5G wireless systems so that students can design applications using 5G equipment & services. First topics are principles of mobile systems, 5G systems (core/radios), application types in 5G, and related wireline / wireless methods. In depth study of 5G explores the major flows in the Core & Radio Access, the behavior of the radio’s physical layer and how applications are supported, features of 5G systems (Voice, SMS, Location, Network Slicing, Analytics), and 5G standards. 5G services and equipment covers elements to build solutions using 5G. 5G Advanced changes by 2025 are reviewed to consider new features in designs. Connectivity aspects of 5G teaches security, energy impact, use of Non-Terrestrial Networks. Finally the evolution to 6G is reviewed.","3GPP, Radio Access Network, General Packet Radio Service, 5G Technology, Radio Equipment, Wireless System Design",Beginner,Subscription,12700,Gerald Karam,2024-01-11 14:05:23.475000+00:00,single course,18 hours,93,4.8,3873,Other
cd0327,Introduction to Artificial Intelligence,https://www.udacity.com/course/intro-to-artificial-intelligence--cd0327,Udacity,en-us,Build a strong foundation in artificial intelligence by exploring core concepts from both a theoretical and practical perspective. This course blends essential principles with real-world problem-solving.,"Constraint propagation, Constraint satisfaction problems, Backtracking search, AI algorithms in Python, Search algorithms",Advanced,Subscription,12700,"Arpan Chakraborty, David Joyner, Thad Starner",2025-12-23 10:49:17.322000+00:00,single course,6 hours,6,4.7,192,Other
cd0666,"Numpy, Pandas, Matplotlib",https://www.udacity.com/course/numpy-pandas-matplotlib--cd0666,Udacity,en-us,"Strengthen your Python data skills by working with NumPy, Pandas, and Matplotlib to analyze, transform, and visualize data using industry-standard tools used across data teams.","Python package management, Pandas, Pip, Anaconda, matplotlib, Jupyter notebooks, NumPy, Python packaging",Beginner,Subscription,12700,"Mat Leonard, Juan Delgado, Juno Lee, Mike Yi, PhD",2026-04-05 11:19:33.501000+00:00,single course,8 hours,0,0,0,Data Analytics
cd0236,Data Ingestion with Kafka and Kafka Streaming,https://www.udacity.com/course/data-ingestion-with-kafka-and-kafka-streaming--cd0236,Udacity,en-us,"Learn to use REST Proxy, Kafka Connect, KSQL, and Faust Python Stream Processing and use it to stream public transit statuses using Kafka and Kafka ecosystem to build a stream processing application that shows the status of trains in real-time.","Faust, Confluent Kafka Python client, Kafka rest proxy, KSQL, Kafka connect, Streaming data stores, Kafka basics, Apache Avro, SQL window functions, SQL aggregations, Data streaming schemas, Stream processing use cases, SQL queries, Kafka performance monitoring, Data serialization, Data deserialization, Data privacy principles, Batch processing, Kafka schema registry, Timeframing in stream processing, Command line interface basics, Windowing in stream processing, Stream processing",Advanced,Subscription,12700,Ben Goldberg,2026-04-12 15:06:59.057000+00:00,single course,40 hours,0,0,0,Other
cd0232,Dashboard Design,https://www.udacity.com/course/dashboard-designs--cd0232,Udacity,en-us,"In this course, you’ll learn the process of designing and creating dashboards within an enterprise environment. You’ll learn to discover user needs, identify key metrics, and tailor your dashboard to a particular audience. You’ll learn to use design elements to maximize the effectiveness of the dashboard and how to iterate based on user feedback.","Usability testing, Wireframes, Feedback loops, Business KPIs, Stakeholder analysis, Chart types, Data visualization design",Beginner,Subscription,12700,Robert Crocker,2026-04-05 11:23:39.110000+00:00,single course,13 hours,0,0,0,Data Analytics
cd0032,Designing Data Systems,https://www.udacity.com/course/designing-data-systems--cd0032,Udacity,en-us,"Design scalable data systems from the ground up. Practice data staging, transformation, and warehouse construction while learning to create centralized architectures for enterprise-wide insights and decision-making.","Data architecture fluency, Data ingestion, Star schemas, ELT, Erds, SQL queries, Database normalization, Data cleaning, Database schemas, Data dictionaries, Snowflake schemas, Data definition, Online transactional processing models, Operational data store models, Online analytical processing models, Data staging",Advanced,Subscription,12700,Shankar Korrapolu,2026-03-26 11:31:14.824000+00:00,single course,18 hours,2,5,76,Database
cd0027,Product Design,https://www.udacity.com/course/product-design--cd0027,Udacity,en-us,"Transform ideas into user-validated products by applying design sprints, rapid prototyping, and research-driven decision making, taking concepts from problem definition through testing, iteration, and engineering-ready specifications.","Product design sprints, Project evaluation, Solution sketching, Decision matrix method, Product validation, User research planning, Evangelization, Press releases, Thinking hats, Crazy 8s, Product success metrics, Product design principles, User interviews, Iterative product design, Technical feasibility evaluation, Affinity mapping, Product storyboarding, Product KPIs, High fidelity prototypes, Product management basics, How might we method, Stakeholder management, Product prototyping",Beginner,Subscription,12700,Alex King,2026-01-12 13:26:59.472000+00:00,single course,12 hours,0,0,0,UI/UX Design
cd12528,Small Datasets in Machine Learning,https://www.udacity.com/course/small-data--cd12528,Udacity,en-us,"Learn to clean messy data, uncover trends, and create compelling visualizations. Build fluency with Python, Pandas, and Matplotlib while applying advanced wrangling techniques to deliver clear, data-driven insights.","Transfer learning, Linear regression, Variational autoencoders",Intermediate,Subscription,12700,Matt Swaffer,2025-10-05 12:36:15.845000+00:00,single course,8 hours,2,5,81,Machine Learning
cd13413,Systems Engineering,https://www.udacity.com/course/systems-engineering--cd13413,Udacity,en-us,"This course introduces Systems Engineering principles, focusing on the lifecycle of complex systems. You will explore key concepts such as system design, architecture, requirements analysis, modeling, and verification. The course covers various system lifecycle models, including Waterfall, V-Model, Spiral, and Agile. You’ll also learn essential tools like SysML for system modeling, risk management, and trade-off analysis. In the final project, you will design and validate a Smart Home Security System, documenting requirements, evaluating design trade-offs, and creating system models. You will also develop a verification and validation plan to ensure the system meets user needs.","System Models, System Verification, Requirement Validation and Verification, Togaf framework, System Integration, Systems Engineering Core Principles, Software development lifecycle, SysML, System Validation, Zachman framework, Architectural Frameworks, Systems thinking, Systems Engineering Stages, ReqView, Requirements gathering, Requirements Management, System Design Principles, Requirements Analysis",Intermediate,Subscription,12700,José Cano,2026-04-20 18:16:35.443000+00:00,single course,13 hours,0,0,0,Software Engineering
cd12034,Predictive Data Analysis,https://www.udacity.com/course/predictive-data-analysis--cd12034,Udacity,en-us,"Find patterns in data and predict future outcomes with Power BI. Learn regression, clustering, and forecasting techniques to transform historical information into insights that drive smarter business decisions.","Cluster models, Time-series analysis, Automated machine learning, Power BI Data Pipeline, Classification models, Advanced data visualizations, Power BI Report Design, Time-series forecasting, Linear regression, Power BI Report Customization",Beginner,Subscription,12700,Daniel Roca,2025-10-07 15:23:43.568000+00:00,single course,18 hours,0,0,0,Data Analytics
