course_id,Course_Title,Course_URL,Platform,Language,Description,Skill,Level,Price_Model,monthly_price,Programming Instructor,Last Update,offering_type,Duration_Hours,Review_Count,Avg_Rating,enrolled_students,Best_Category
cd13764,AI Agents with LangChain and LangGraph,https://www.udacity.com/course/ai-agents-with-langchain-and-langgraph--cd13764,Udacity,en-us,"Master the design of AI-driven agents with LangChain and LangGraph. Automate workflows, implement RAG pipelines, and create interactive systems for knowledge management and application development.","AI Agents, Retrieval-Augmented Generation, LangGraph, LangChain",Intermediate,Subscription,12700,Henrique Santana,2026-03-31 13:11:14.609000+00:00,single course,15 hours,39,4.6,828,Other
nd043,Digital Project Management,https://www.udacity.com/course/digital-project-management-nanodegree--nd043,Udacity,en-us,"Prepare for a fast-growing career in digital project management. Learn to translate business needs into actionable plans, apply Agile and Waterfall methods, and drive results for diverse industries.","Cost-benefit analysis, Project risk mitigation, Scrum, S.M.A.R.T. goals, Requirements gathering, Professional portfolios, Project execution, Project status reporting, Project scoping, Project closure, Project scheduling, Strategic communication plans, Project initiation, Business KPIs, Knowledge sharing, Gantt charts, Waterfall project management, Project monitoring and control, Stakeholder analysis, Project management artifacts, Scrum boards, Project management frameworks, Agile frameworks, The Tuckman ladder, Project planning, STARI stories, Sprint planning, Software development lifecycle, Team development, Raci matrices",Beginner,Subscription,12700,Walyce Almeida,2025-10-08 12:58:43.730000+00:00,Nanodegree,22 hours,50,4.9,2365,Business & Management
nd0277,Data Engineering with Microsoft Azure,https://www.udacity.com/course/data-engineering-with-microsoft-azure-nanodegree--nd0277,Udacity,en-us,"Become an expert in cloud data engineering with this Nanodegree. Design scalable data architectures, build pipelines, and use Azure tools like Databricks and Synapse to drive powerful data insights.","PostgreSQL, Database normalization, Denormalized data schemas, Data modeling basics, Azure Data Factory, Data pipeline creation, Data pipeline maintenance, Azure pipelines, Data pipeline dags, Big data fluency, Databricks, Apache Spark, Data lakes, Data warehouse architecture, SQL databases in Azure, Database fundamentals, Infrastructure as code, Olap cubes, Cloud computing fluency, Data extraction, Azure blob storage, Azure portal, Azure Synapse Analytics, Online transactional processing models, AWS database services, Data definition language, Neo4j, NoSQL data models, Mongodb, Relational data models, Online analytical processing models, Document database schemas",Advanced,Subscription,12700,"Vishnu (Lucky) Pamula, Amanda Moran, Matt Swaffer, PhD",2026-04-23 12:39:17.164000+00:00,Nanodegree,56 hours,7,4.4,308,Database
cd14524,Building Agents,https://www.udacity.com/course/building-agents--cd14524,Udacity,en-us,"Build robust AI agents. Integrate tools via function calling, generate structured outputs with Pydantic, manage agent state, and utilize short-term and long-term memory. Create data-driven agents that interact with external APIs, search the web, query SQL databases, and perform agentic RAG for dynamic retrieval. Learn to evaluate agent performance for reliable, real-world applications.","Implementing API Integration for Agents, Implementing Single-agent RAG, Implementing AI Agent Evaluation, State Management for AI Agents, API Integration for Agents, Implementing Long-term Memory Management for AI Agents, Agent Tool Use, Database Interaction for AI Agents, Long-term Memory Management for AI Agents, Implementing Agent Memory, Implementing State Management for AI Agents, Agent Memory Design, Implementing Agent Tool Use, Web Search Integration & Data Retrieval for AI Agents, Evaluating AI Agents, Implementing Database Interaction for AI Agents, Implementing LLM Structured Outputs, Single-Agent Retrieval Augmented Generation, Implementing Web Search Integration and Data Retrieval for AI Agents, LLM Structured Outputs",Intermediate,Subscription,12700,Henrique Santana,2026-04-18 10:18:10.944000+00:00,single course,11 hours,288,4.6,13454,Other
nd081,Cloud Developer using Microsoft Azure,https://www.udacity.com/course/cloud-developer-using-microsoft-azure-nanodegree--nd081,Udacity,en-us,"Master cloud development with this Nanodegree on Microsoft Azure. Learn to build, deploy, migrate, and monitor applications while preparing for the AZ-204 certification through real-world projects.","Cloud migration, Cloud security in Azure, Microservices architecture basics, Azure monitor, Cloud cost management, SQL databases in Azure, Cloud observability, Azure automation, Azure app service, Azure logic apps, Azure event grid, Azure resource groups, Azure blob storage, Cloud resource allocation, Azure Compute Services, Microservices architecture design, Azure log analytics, Root cause analysis, Cloud availability, Azure autoscale, Azure batch, Azure database migration service, API security, Azure kubernetes service, Azure cosmosdb, Azure API endpoints, Azure container registry, Cloud computing fluency, Azure functions, Azure portal",Intermediate,Subscription,12700,"Ann K. Hoang, Nathan Anderson, Golois Mouelet, Chris Vasquez",2026-04-02 10:17:07.957000+00:00,Nanodegree,51 hours,45,4.3,1925,Cloud Computing
cd11524,Business Analytics Fluency,https://www.udacity.com/course/business-analytics-fluency--cd11524,Udacity,en-us,"In this course, you will learn fundamental topics of business analytics. You will learn how to use data to drive business decisions and solve business problems.","Linear regression, Business Analytics Fluency",Fluency,Subscription,12700,Not Listed,2024-01-08 20:23:37.960000+00:00,single course,6 hours,5,4.8,104,Data Analytics
nd082,Cloud DevOps using Microsoft Azure,https://www.udacity.com/course/cloud-devops-using-microsoft-azure-nanodegree--nd082,Udacity,en-us,"Merge cloud infrastructure with DevOps practices on Microsoft Azure. This Nanodegree program covers how to deploy, test, and monitor applications while mastering infrastructure as code, CI/CD pipelines, and quality assurance.","Software performance testing, Functional testing, Test environments, Logging, Cloud observability, Azure log analytics, Selenium, Integration testing, Infrastructure as code, Data validation, Azure monitor, CI/CD, Apache JMeter, Terraform, Postman, Test automation, Continuous improvement, Build automation, Trello, Agile methodologies, Pytest, Platform as a service, Continuous integration, Building agile teams, Azure app service, Root cause analysis, Project management, Github actions, Continuous deployment, Azure pipelines, Technical communication, Pylint, Gitops, Azure resource manager, Devops business context, Azure conditional access policies, Virtual machine management, Devops fluency, Azure user management, Microsoft Entra ID, Software project documentation, Cloud performance management, Azure CLI, Network security with Azure, Azure security center, Packer",Intermediate,Subscription,12700,"Erick Galinkin, Noah Gift, Nathan Anderson",2025-12-02 17:26:44.715000+00:00,Nanodegree,54 hours,82,4.3,3541,DevOps
nd00333,Machine Learning Engineer with Microsoft Azure,https://www.udacity.com/course/machine-learning-engineer-for-microsoft-azure-nanodegree--nd00333,Udacity,en-us,"Scale your ML solutions in the cloud. Use Azure Machine Learning Studio, SDK, AutoML, and Azure Pipelines to deploy and monitor models, mastering pipeline automation, Kubernetes security, and API management.","Azure ML user management, Azure data services, AI business context, Azure ML platform, Model deployment with Azure, Azure ML pipelines, Kubernetes security, API troubleshooting, REST APIs, Open neural network exchange, Hyperparameter tuning, Azure ML designer, Model interpretation, Azure ML sdk, Azure ML experiments, Model maintenance, Cloud asset management, Deployment testing, Azure kubernetes service, Swagger, Docker, Model evaluation, Kubernetes, ApacheBench, Azure ml automated ML",Intermediate,Subscription,12700,"Erick Galinkin, Noah Gift, Soham Chatterjee, Alfredo Deza",2025-11-14 06:46:56.886000+00:00,Nanodegree,40 hours,83,4.1,3173,Cloud Computing
cd0022,Business Metrics with Spreadsheets,https://www.udacity.com/course/introduction-to-data-analytics-for-business--cd0022,Udacity,en-us,"Turn spreadsheets into a powerful decision-making tool. This course covers how to interpret data, calculate essential business metrics, and visualize trends that reveal performance, opportunities, and strategic direction.","Scatter Plot Awareness, Growth metrics, Spreadsheet Navigation, Data visualization in spreadsheets, KPI Awareness, Lookups and Pivoting, Finance metrics, Line and Area Charts in Spreadsheets, Basic spreadsheet use, Tabular Data Awareness, Spreadsheet Operations, Efficiency Metrics, Data Relationships, Pie Charts in Spreadsheets, Spreadsheet Cell Referencing, Scatter Plots in Spreadsheets, Pie Chart Awareness, Business metrics, Customer Satisfaction Metrics, Bar and Column Charts in Spreadsheets, Function and Formula Syntax, Histograms in Spreadsheets, Bar and Column Chart Awareness, Spreadsheet functions, Data types, Histogram Awareness, Profitability Metrics, Date and Data Cleanup, Basic descriptive statistics, Line and Area Chart Awareness, Chart types, Chart Selection and Formatting in Spreadsheets, Innovation Metrics, Pivot tables, Data Summarization, Logic and Aggregation Formulas",Beginner,Subscription,12700,Jayden Ziegler,2025-12-05 08:27:27.202000+00:00,single course,11 hours,6,4.8,201,Data Analytics
nd037,Growth Product Manager,https://www.udacity.com/course/growth-product-manager-nanodegree--nd037,Udacity,en-us,"Level up your product management skills with this Nanodegree program. Apply data science to create product proposals, design scalable data infrastructures, optimize with A/B testing and cohort analysis, and master UX design principles to enhance user experiences.","Product monetization metrics, Product monetization strategy, Growth loops, Target personas, Premium value, Customer acquisition cost, Product monetization tactics, Product financial metrics, Product strategy, A/B testing, Cost per acquisition, Ux design principles, Product channel strategy, Growth metrics, Lifetime value, Customer retention tactics, Cohort analysis, Ux friction, Experiment design, Conversion rate, Activation metrics, User journey maps, Ice scoring model, Customer churn rate, Audience behavior tracking, User personas, Experiment metrics, AARRR Metrics Framework, Growth bottlenecks, Ansoff matrix, Product strategy business context, Project evaluation",Beginner,Subscription,12700,"Katherine Wu, Shiv Patel, Rizwan Ansary",2025-10-10 08:44:43.052000+00:00,Nanodegree,57 hours,44,4.6,1864,Data Analytics
cd0021,Introduction to SQL,https://www.udacity.com/course/introduction-to-sql--cd0021,Udacity,en-us,"Get a beginner-friendly introduction to SQL that covers querying, joins, aggregations, and data cleaning, with clear guidance on choosing the right commands and using query results to answer business questions.","SQL subqueries, SQL joins, SQL aggregations, SQL window functions, SQL queries, SQL query performance tuning, Data cleaning",Beginner,Subscription,12700,"Ziad Saab, David Elliott, Derek Steer, Malavica Sridhar",2026-02-08 15:08:09.305000+00:00,single course,18 hours,10,4.8,321,Data Analytics
cd0685,Machine Learning and AI for Business Leaders,https://www.udacity.com/course/machine-learning-and-ai-for-business-leaders--cd0685,Udacity,en-us,"The goal of the Machine Learning and AI for Business Leaders course is to equip business leaders and senior decision-makers with the foundational knowledge needed to assess, lead, and support AI/ML initiatives in their organizations. Unlike more technical or product-focused programs, this course focuses on strategic understanding, evaluation, and organizational alignment—helping leaders build confidence, avoid pitfalls, and champion responsible and effective AI/ML use.","Machine learning fluency, Beta testing, Machine learning dataset fundamentals, Machine learning system architectures, Machine learning use cases, Product storyboarding, Product proposals, Model performance metrics, AI business context, Dataset annotation, AI fluency, Machine learning experiments, Iterative product design, Overfitting prevention, Deep learning fluency, Reinforcement learning applications, Ethical AI, Product roadmaps",Intermediate,Subscription,12700,"Jasmine Lawrence Campbell, Anurag Srivastava, Brad Nemer",2026-05-05 12:19:33.130000+00:00,single course,7 hours,4,5,159,Artificial Intelligence
cd13152,How to Write a Cover Letter to Get Hired,https://www.udacity.com/course/craft-your-cover-letter--cd13152,Udacity,en-us,"In today's job market, a well-crafted cover letter is not a mere accessory, but a powerful tool that can make a difference. Learn more about how to use your cover letter to tell a compelling story, and submit your cover letter to be reviewed by our industry experts who will give you personalized feedback on how to highlight your unique skills and make a strong case for why you're the perfect fit for a role.","Cover letters, External communications, Communication strategies, Career success",Beginner,Subscription,12700,Melanie Mitchell,2025-06-03 19:02:52.008000+00:00,single course,3 hours,2,5,98,Other
nd064,Cloud Native Application Architecture,https://www.udacity.com/course/cloud-native-architecture-nanodegree--nd064,Udacity,en-us,"Become an expert in cloud-native application architecture. Gain real-world skills in building, securing, and monitoring scalable apps using industry-standard tools like Prometheus, Jaeger, ArgoCD, gRPC, and Grafana.","Cloud observability, Stride framework, Microservices security, Refactoring from a monolith, Kubernetes security, Docker security, Cis benchmarks, Prometheus, Jaeger, Application tracing, Grafana, Message passing, Grpc, Cloud communication protocols, REST APIs, Cloud architecture model types, Kubernetes, Cloud computing fluency, Argo cd, Shift-left testing, Microservices hardening test plans, Image signing, Trivy, Runtime security monitoring, Kube-bench, Docker-bench, Nist nvd, Image layer analysis, Sysdig falco, Cybersecurity incident response playbooks, Owasp top-10, Grype, Software composition analysis, Application code vulnerabilities, Image hardening, Syft, Site reliability metrics, Observability dashboards, Message queues, Strangler pattern, Kafka basics, Cloud dependency maps, Cloud migration strategy, OpenAPI, Platform as a service, Cloud foundry, Template manifests, Helm, Github actions, CI/CD, Declarative manifests, Application development best practices, Docker",Intermediate,Subscription,12700,"Justin Lee, Nick Reva, Katie Gamanji, Jay Smith",2026-04-29 10:13:51.016000+00:00,Nanodegree,72 hours,51,4.7,1103,Cloud Computing
cd5231,Digital Project Management Fluency,https://www.udacity.com/course/digital-project-management-fluency--cd5231,Udacity,en-us,"In this course, you will learn some essential and fundamental topics of digital project management. You will learn what is digital project management, when to use it, how it came to be, the business justifications of digital projects, common digital project management methodologies, and the five stages of the digital project management lifecycle.","Leadership styles, Digital Project Management Fluency",Fluency,Subscription,12700,Not Listed,2022-09-08 23:50:35.302000+00:00,single course,9 hours,2,5,99,Business & Management
cd12590,Data Modeling Fluency,https://www.udacity.com/course/data-modeling-fluency--cd12590,Udacity,en-us,"Perfect for beginners, this course introduces relational and NoSQL databases, schemas, and normalization while providing a high-level overview of big data systems that manage today’s massive datasets.",Data Modeling Fluency,Fluency,Subscription,12700,Not Listed,2025-12-28 23:18:29.141000+00:00,single course,9 hours,1,3,40,Database
nd350,Ethical Hacker,https://www.udacity.com/course/ethical-hacker-nanodegree--nd350,Udacity,en-us,"Master ethical hacking and penetration testing skills to advance your cybersecurity career. Learn reconnaissance, OSINT, password attacks, and vulnerability management through hands-on projects guided by expert instructors.","Report writing, Cybersecurity reconnaissance, Open-source intelligence, Owasp wstg, Digital footprint removal, Password attacks, Osint tools, Vulnerability management, Exploit code execution, Metasploit, Link analysis, Open source vulnerability database, Digital footprint analysis, SQL injection, Cybersecurity pivoting, Web hacking, Cherrytree, Backdoors, Passive cybersecurity reconnaissance, Social engineering, Phishing, Gophish, Security risk classification, Nessus, Security assessment, On-premise cyber attacks, Service enumeration, Advanced persistent threat, Steganography, Owasp zap, Active cybersecurity reconnaissance, Data exfiltration, Nmap, Dig, Router hacking, Privilege escalation, Traceroute, Dirb, Netdiscover, Port scanning, Nslookup, John the ripper, Wpscan, Cyber attack persistence, Keystroke logging, Port forwarding, Web application vulnerability scanning, Vulnerability exploitation, Cvss, Hash cat, Vulnerability scanning, Exploitdb, Veil-evasion, Burp suite, Google hacking, Cybersecurity ttps, SQLmap, Maltego, Malware development, Automated penetration testing, Semi-automated penetration testing, Exploratory data analysis, Nikto, Vulnerability research, Red teaming, Vulnerability assessment",Advanced,Subscription,12700,"Paul Oyelakin, Sagar Bansal",2026-03-23 09:13:52.832000+00:00,Nanodegree,37 hours,24,4.2,1143,Cyber Security
cd1880,Data Science Fluency,https://www.udacity.com/course/intro-to-data-science-fluency--cd1880,Udacity,en-us,"Learn the data science process, including how to build effective data visualizations, and how to communicate with various stakeholders.","Linear regression, Data science fluency",Fluency,Subscription,12700,Not Listed,2024-06-27 00:38:37.570000+00:00,single course,6 hours,0,0,0,Data Science
nd698,Security Engineer,https://www.udacity.com/course/security-engineer-nanodegree--nd698,Udacity,en-us,"Build the skills needed to outsmart cyber threats. This Nanodegree teaches you how to secure infrastructure, assess vulnerabilities, and apply top industry practices to protect your organization from digital attacks.","Static application security testing, Software development lifecycle, Owasp top-10, Access management, Cybersecurity business context, Hashing, Cybersecurity risk management, It asset management, Vulnerability assessment, Cybersecurity strategy, Data encryption, Cvss, Owasp, Firewall configuration, Application security best practices, Vulnerability management, Security risk classification, Cybersecurity reconnaissance, Report writing, Cross-functional collaboration, Cybersecurity framework implementation, Microservices security, Security auditing, Security information and event management, Credential management, Adversarial simulation, Public key certificate management, Vulnerability scanning, Backup strategy, Golden images, Ipv6 security, Vulnerability patching, Firewalls, Network segmentation, VPN, Nmap, Network access control lists, Tcp/ip, Disaster recovery plans, Network monitoring, Multi-factor authentication, Security patch management, Cybersecurity standards fluency, Host-based idss, Yara rules, Cve, Server hardening strategy, Vulnerability exploitation, Operating system hardening, File integrity monitoring, Cybersecurity controls, Authentication, Cybersecurity fluency, Cybersecurity compliance, Cybersecurity resource fluency, Threat modeling, Cryptography, Fuzzing, Shift-left testing, Brute force attacks, Microsoft domain isolation policy design, Remote access management, Web application firewalls, Mandatory access control, Role-Based Access Control, Wireshark, Perimeter security, Principle of least privilege, Virtual lan, Packet analysis, Access control models, Endpoint security, Threat mitigation, Cybersecurity segregation of duties, Chroot jails, Threat hunting, Intrusion detection systems, Advanced persistent threat, Osquery, Data security fundamentals, Cybersecurity advisories, Unix os hardening, Intrusion prevention, Security architecture fundamentals, Authorization, Cybersecurity grc, Cia triad, Non-repudiation, Public key certificates, Public key infrastructure, Logging",Intermediate,Subscription,12700,"Dev Badlu, Rod Soto, Abhinav Singh, Taylor Lobb",2025-12-25 09:57:03.828000+00:00,Nanodegree,90 hours,33,4.7,726,Cyber Security
nd045,Data Science for Business Leaders,https://www.udacity.com/course/data-science-for-business-leaders--nd045,Udacity,en-us,"Master the fundamentals of leading data science initiatives. Understand business strategy, team structure, data architecture, and project risks while building an actionable 100-day data science implementation plan.","Data science strategy, Data science business context, Project risk mitigation, Data and data architecture strategy, Project evaluation, Building data science teams, Stakeholder management, Product management basics, Structured problem solving method, Data science use-cases",Beginner,Subscription,12700,Ed Wiley,2025-12-05 08:25:10.002000+00:00,Nanodegree,25 hours,74,4.4,2033,Data Science
cd0282,Java Fundamentals,https://www.udacity.com/course/java-fundamentals--cd0282,Udacity,en-us,"Master Java fundamentals through practical lessons on classes, inheritance, collections, and exceptions. Cement your knowledge by building a working hotel reservation system to showcase your new skills.","Java data types, Java inheritance, Java syntax, Java generics, Java exception handling, Date and time in Java, Java standard library, Java enums, Java documentation, Java data structures, Regular expressions, Java package management, Java string methods, JRE, Computer memory architecture, Java methods, Control flow in Java, Java arrays, Java type casting, Intellij, Java collections",Intermediate,Subscription,12700,Jeff Phillips,2025-12-19 19:12:46.092000+00:00,single course,20 hours,182,4.8,8270,Database
nd090,Cloud Architect using Microsoft Azure,https://www.udacity.com/course/cloud-architect-using-microsoft-azure-nanodegree--nd090,Udacity,en-us,"Go beyond theory with this Nanodegree. Gain hands-on experience with cost optimization, infrastructure monitoring, and cutting-edge cloud security practices, including Zero Trust Architecture and advanced IAM solutions.","Cloud cost policies, Cloud cost evaluation, Automated cloud cost optimization, Azure security center, Azure key vault, Azure defender, Privileged identity management, Azure pricing calculator, Azure resource manager, Azure ad connect, Identity and access management fundamentals, Multi-factor authentication, Distributed denial-of-service protection, Azure network watcher, Resource hardening with Azure, Data encryption, Zero trust security model, Database security, Azure sentinel, Azure bastion, Azure web application firewall, Azure conditional access policies, Azure smart alerts, Azure log analytics, Cloud resource provisioning, Azure insights, Cloud operational efficiency, Azure total cost of ownership calculator, Cloud availability, Azure Load Balancing Services, Cloud blueprints, Azure site recovery, Azure blueprints, Cloud migration strategy, Azure virtual machine backup, Azure desired state configuration, Cloud design principles, Cloud migration, Azure migrate, Route based vpn, Cloud computing business context, Azure Network Security Groups, Microsoft Entra ID, Hybrid cloud, Disaster recovery plans",Advanced,Subscription,12700,"Pratik Shah, Gary McLeary, Ed Clausen",2025-08-04 08:17:24.771000+00:00,Nanodegree,53 hours,5,4.8,128,Cloud Computing
cd14526,Prompting for Effective LLM Reasoning and Planning,https://www.udacity.com/course/prompting-for-effective-llm-reasoning-and-planning--cd14526,Udacity,en-us,"Go beyond basic chatbots and learn to engineer sophisticated AI agents. Learn advanced prompting techniques that power modern AI. You'll master Chain-of-Thought, ReAct, and feedback loops to build systems that can reason, plan, and solve complex problems. Through hands-on exercises, you will transform generic AI into specialized, reliable tools, culminating in building a multi-agent travel planner from scratch.","Iterative Prompt Development, Implementing Role-Based Prompting, Feedback Loop Design, Persona-Based Prompt Design, Implementing Prompt Chains, Systematic Prompt Refinement, CoT and ReAct, Agentic Reasoning Frameworks, Prompt Chain Design, Implementing Feedback Loops",Intermediate,Subscription,12700,Brian Cruz,2026-05-04 11:05:55.226000+00:00,single course,13 hours,12,4.8,551,Other
nd588,Statistics for Data Analysis,https://www.udacity.com/course/statistics-for-data-analysis-nanodegree--nd588,Udacity,en-us,"Learn core statistics for data analysis, including probability, regression, and experiment design. Build practical Python skills to analyze data and prepare for analyst and data scientist roles.","Statistical modeling fundamentals, Logistic regression, Linear regression, Linear functions, Normal distribution, A/B testing, Experiment design, Statistical sampling, Pandas, Inferential statistics, Interpreting test results, Conditional probability, Bayes' theorem, Probability distribution, Basic probability, Basic descriptive statistics, Outlier analysis, Technical communication",Beginner,Subscription,12700,"Sebastian Thrun, Josh Bernhard",2026-02-19 13:27:01.786000+00:00,Nanodegree,64 hours,5,4.2,247,Data Science
